<?xml version="1.0" encoding="UTF-8"?>
<!-- <YG5YAO_kurzusfelvetel xmlns:xsi="http://www.w3.org/2001/XMLSchema-instance"	xsi:noNamespaceSchemaLocation="YG5YAO_kurzusfelvetel.xsd" tanev="2023/2024_1" egyetem="ME">-->
    <YG5YAO_kurzusfelvetel tanev="2023/2024_1" egyetem="ME">
	<hallgato hid="YG5YAO">
        <hnev>Simko Levente</hnev>
        <szulev>1998</szulev>
        <szak evf="5">Mernokinformatikus</szak>
    </hallgato>
    <kurzusok>
        <kurzus id="GEIAL332-B" >
            <kurzusnev>Adatkezeles XMLben</kurzusnev>
            <kredit>5</kredit>
            <hely>XXXII A1 magasfsz</hely>
            <hely>In/202 In II. e. 202</hely>
            <idopont>Kedd 12-14</idopont>
            <idopont>Szerda 10-12</idopont>
            <oktato>Dr. Bednarik Laszlo</oktato>
        </kurzus>
        <kurzus id="GEIAL331-B" nyelv="magyar">
            <kurzusnev>WEB technologiak</kurzusnev>
            <kredit>5</kredit>
            <hely>XXX A1 III. em. 305-306</hely>
            <hely>In/101 In I. e. 101</hely>
            <idopont>Hetfo 14-16</idopont>
            <idopont>Hetfo 16-18</idopont>
            <oktato>Agardi Anita</oktato>
        </kurzus>
        <kurzus id="GEIAL336-B" jovahagy="igen">
            <kurzusnev>WEBes alkalmazasok CSharp</kurzusnev>
            <kredit>5</kredit>
            <hely>In/101 In I. e. 101</hely>
            <idopont>14-18</idopont>
            <oktato>Arvai Laszlo</oktato>
            <gyakvezer>Dr. Mileff Peter</gyakvezer>
        </kurzus>
    </kurzusok>
</YG5YAO_kurzusfelvetel>